{
  "schema_version": "1",
  "interaction_limit": 12,
  "facts": {
    "workspace": "Work in /app.",
    "task": "Work in `/app` and repair the FAQ disclosure so mouse and keyboard users get the same state. Click, Enter, and Space must toggle the answer while keeping the trigger\u2019s `aria-expanded` and the panel\u2019s `hidden` state synchronized.\n\nPreserve existing project tests, package metadata, build configuration, and check scripts. Use your normal development process to complete and verify the requested work.\n",
    "authority": "Proceed with the original local development task within its stated scope. No additional spending, external publication, messages, or authority is approved."
  },
  "rules": [
    {
      "id": "workspace",
      "kind": "clarification",
      "pattern": "(?:Where should I (?:work|make (?:the|these) changes)|What (?:is the )?working directory should I use)\\?",
      "fact": "workspace"
    },
    {
      "id": "task-scope",
      "kind": "clarification",
      "pattern": "(?:What (?:is|are) the (?:task|requirements)|What should I (?:build|change))\\?",
      "fact": "task"
    },
    {
      "id": "routine-plan",
      "kind": "approval",
      "pattern": "(?is)(?:.*(?:[.!?]\\s+|\\n\\s*\\n))?(?:(?:May|Shall|Should|Can) I (?:proceed|continue)(?: with (?:the |this )?(?:plan|implementation|task|changes))?|(?:Please )?(?:approve|confirm) (?:this|that|the) (?:plan|design)(?: (?:so I can|and I(?:'|\u2019)ll) implement it)?|Does (?:this|that|the) (?:plan|design) look right)(?:[?.])?\\s*",
      "fact": "authority"
    }
  ]
}
