{
  "schema_version": "1",
  "interaction_limit": 12,
  "facts": {
    "workspace": "Work in /app.",
    "task": "Polish the notification card in Styles.css only. Preserve all copy, HTML, and behavior. Give the card clear heading/body hierarchy and comfortable spacing; it must fit 320, 768, and 1440 pixel viewports without horizontal overflow. Use body text at least 16px, heading at least 24px, text contrast at least 4.5:1, a button at least 44px in both dimensions, and a visible keyboard-focus outline. Keep the card at most 640px wide with at least 16px internal padding. Choose the visual treatment; this is a bounded card refinement, not a redesign of the application. Use solid-color backgrounds only. Gradients, background images, CSS filters/backdrop filters, masks, clipping paths and blend modes are outside this fixture's supported paint contract; typography, palette, spacing, borders and responsive layout remain your design choices.",
    "authority": "Proceed with the original local development task within its stated scope. No additional spending, external publication, messages, or authority is approved.",
    "handoff": "Keep the branch and workspace as-is. Do not merge, push, publish, discard changes, or remove the worktree. Report the local handoff and stop."
  },
  "rules": [
    {
      "id": "workspace",
      "kind": "clarification",
      "pattern": "(?:Where should I (?:work|make (?:the|these) changes)|What (?:is the )?working directory should I use)\\?",
      "fact": "workspace"
    },
    {
      "id": "task-scope",
      "kind": "clarification",
      "pattern": "(?:What (?:is|are) the (?:task|requirements)|What should I (?:build|change))\\?",
      "fact": "task"
    },
    {
      "id": "routine-plan",
      "kind": "approval",
      "matcher": "local-development-approval",
      "fact": "authority"
    },
    {
      "id": "local-handoff",
      "kind": "clarification",
      "matcher": "local-branch-handoff",
      "fact": "handoff"
    }
  ]
}
