{
  "schema_version": "1",
  "interaction_limit": 12,
  "facts": {
    "workspace": "Work in /app.",
    "task": "Repair the file-backed queue across deterministic persistence and process-crash boundaries. Preserve the existing fault hooks, recover unfinished jobs exactly once across repeated restarts, and keep idempotency permanent through completion without claiming exactly-once external side effects.",
    "authority": "Proceed with the original local development task within its stated scope. No additional spending, external publication, messages, or authority is approved.",
    "handoff": "Keep the branch and workspace as-is. Do not merge, push, publish, discard changes, or remove the worktree. Report the local handoff and stop."
  },
  "rules": [
    {
      "id": "workspace",
      "kind": "clarification",
      "pattern": "(?:Where should I (?:work|make (?:the|these) changes)|What (?:is the )?working directory should I use)\\?",
      "fact": "workspace"
    },
    {
      "id": "task-scope",
      "kind": "clarification",
      "pattern": "(?:What (?:is|are) the (?:task|requirements)|What should I (?:build|change))\\?",
      "fact": "task"
    },
    {
      "id": "routine-plan",
      "kind": "approval",
      "matcher": "local-development-approval",
      "fact": "authority"
    },
    {
      "id": "local-handoff",
      "kind": "clarification",
      "matcher": "local-branch-handoff",
      "fact": "handoff"
    }
  ]
}
